destination,duration,budget,core_prefs,special_prefs,itinerary
Rome,4,high,"[""culture"", ""nature""]","[""needs_breaks"", ""instagram_worthy"", ""budget_conscious""]","**Day 1: Ancient Rome & Trastevere Charm**  * **Morning (9:00 AM):** Begin your Roman adventure with a private guided tour of the Colosseum and Roman Forum.  Skip the lines with pre-booked tickets and learn captivating stories from your expert guide.  This ensures an immersive and less crowded experience.  Afterwards, enjoy a leisurely stroll through Palatine Hill for breathtaking panoramic views of the city – perfect for Instagram.  * **Lunch (1:00 PM):** Indulge in a luxurious lunch at La Pergola, a three-Michelin-starred restaurant offering exquisite Italian cuisine and stunning views.  This is a splurge-worthy experience.  * **Afternoon (3:00 PM):** Take a relaxing break at a charming café near the Pantheon, enjoying a cappuccino and people-watching.  Then, explore the Pantheon and Piazza Navona, admiring the stunning architecture and vibrant atmosphere.  * **Evening (6:00 PM):**  Explore the picturesque Trastevere neighborhood. Wander its cobblestone streets, discover artisan shops, and soak in the authentic Roman ambiance.  * **Dinner (8:00 PM):** Enjoy a delicious dinner at a traditional Trastevere trattoria, savoring authentic Roman pasta dishes and local wine.  Book in advance for a guaranteed table.   **Day 2: Vatican City & Artistic Wonders**  * **Morning (9:00 AM):**  Start your day with a private Vatican City tour, including skip-the-line access to St. Peter's Basilica and the Vatican Museums.  This allows for a more personalized and efficient visit, focusing on your interests.  Marvel at Michelangelo's Sistine Chapel and the vast collection of art and artifacts.  * **Lunch (1:00 PM):** Enjoy a light and elegant lunch at Borghiciana Pastificio Artigianale near the Vatican, known for its fresh pasta dishes.  * **Afternoon (2:30 PM):**  Visit Castel Sant'Angelo, enjoying the stunning views from its rooftop terrace. Afterwards, take a relaxing boat tour on the Tiber River, offering a unique perspective of the city.  This is a great opportunity for Instagram-worthy shots.  * **Evening (6:00 PM):**  Enjoy some free time to explore the charming neighborhood around your hotel or revisit a favorite spot from the previous day.  * **Dinner (8:00 PM):**  Experience a fine dining experience at Imàgo, located on the rooftop of the Hassler Hotel, offering panoramic views alongside exquisite cuisine.   **Day 3:  Appian Way & Catacombs**  * **Morning (9:00 AM):** Escape the city buzz with a guided bike tour along the ancient Appian Way. This provides a unique perspective of Roman history and offers beautiful scenery amidst the countryside.  Pack water and sunscreen for a comfortable ride.  * **Lunch (1:00 PM):**  Enjoy a picnic lunch amidst the picturesque scenery along the Appian Way.  Pre-order gourmet sandwiches and drinks from a local deli for a convenient and delicious meal.  * **Afternoon (2:30 PM):** Explore the Roman Catacombs, a fascinating and slightly eerie glimpse into early Christian history.  A guided tour is recommended for a richer experience.  * **Evening (5:00 PM):**  Return to the city center and relax at a luxurious spa for a rejuvenating massage and treatment.  * **Dinner (8:00 PM):**  Enjoy a relaxed dinner at a restaurant near your hotel or explore a new neighborhood, selecting a restaurant based on your preferences.   **Day 4: Trevi Fountain & Spanish Steps**  * **Morning (9:00 AM):** Start your day with a visit to the Trevi Fountain early in the morning to avoid the crowds. Toss a coin and capture the magic of this iconic landmark with fewer tourists around – perfect for Instagram.  * **Late Morning (10:30 AM):** Stroll towards the Spanish Steps, enjoying the elegant atmosphere of the surrounding streets and shopping experiences.  * **Lunch (1:00 PM):** Enjoy a delicious lunch at a café near the Spanish Steps, indulging in some classic Italian pastries and coffee.  * **Afternoon (2:30 PM):**  Visit the Borghese Gallery and Museum, admiring masterpieces by Bernini and Caravaggio. Pre-book your tickets to avoid disappointment.  * **Evening (5:00 PM):**  Enjoy some last-minute souvenir shopping and relax at a rooftop bar, enjoying a final Roman sunset before departing.  * **Dinner (7:00 PM):** Enjoy a final celebratory dinner at a restaurant of your choice, reflecting on your unforgettable Roman holiday.   This itinerary"
Paris,4,medium,"[""family"", ""nature""]","[""vegetarian"", ""sustainable"", ""local_experience""]","**Day 1: Parisian Charm and Green Spaces**  * **Morning (9:00 AM):** Start your day with a leisurely stroll through the Jardin du Luxembourg. Rent a sailboat on the pond, let the kids enjoy the playground, and soak in the Parisian atmosphere.  Pack a vegetarian picnic lunch to enjoy amidst the beautiful gardens – you can easily pick up some delicious bread, cheese, and fruits from a local boulangerie the day before. * **Afternoon (1:00 PM):**  Take the metro to the charming Marais district. Explore its picturesque streets, browse independent boutiques, and admire the architecture.  Enjoy a delicious vegetarian lunch at a traditional French bistro in the Marais – many offer creative vegetarian options.  Look for places with outdoor seating to soak up the atmosphere. * **Late Afternoon (3:30 PM):** Visit the Place des Vosges, the oldest planned square in Paris, and relax before heading to your accommodation. * **Evening (6:00 PM):** Enjoy a relaxed dinner at a family-friendly vegetarian restaurant in your neighborhood.  Consider looking for restaurants highlighting seasonal, locally sourced ingredients for a sustainable choice.   **Day 2: Iconic Landmarks and Sustainable Exploration**  * **Morning (9:00 AM):** Begin your day with a visit to the Eiffel Tower. Pre-book your tickets online to skip the long queues.  Afterwards, instead of a typical tourist bus, consider a leisurely walk along the Seine River, enjoying the views and charming bridges. * **Afternoon (1:00 PM):**  Have a picnic lunch near the Seine, enjoying the views of the city.  Alternatively, find a café offering vegetarian options with river views. * **Afternoon (2:30 PM):** Take a Batobus river tour – it's a hop-on-hop-off boat service that allows you to explore different parts of Paris along the Seine. This is a more sustainable option than a traditional bus tour.  Get off at Notre Dame Cathedral (exterior viewing only for now) and explore the Île de la Cité. * **Evening (6:00 PM):** Enjoy dinner at a restaurant in the Latin Quarter known for its vegetarian options and commitment to local and seasonal ingredients.   **Day 3: Montmartre's Artistic Heart and Canal Saint-Martin**  * **Morning (9:00 AM):** Take the metro to Montmartre. Explore the charming streets, visit the Sacré-Cœur Basilica for stunning panoramic views, and enjoy the lively atmosphere of Place du Tertre, where artists create and sell their work. * **Afternoon (1:00 PM):**  Find a small, family-run creperie in Montmartre for a vegetarian lunch.  Many offer sweet and savory crêpes with local ingredients. * **Afternoon (2:30 PM):** Head to the Canal Saint-Martin, a trendy and picturesque area. Enjoy a walk along the canal, browse independent shops, and soak in the relaxed atmosphere. * **Evening (6:00 PM):**  Have dinner at a restaurant near the Canal Saint-Martin known for its vegetarian dishes and a focus on sustainable practices.  The area offers many choices catering to diverse tastes.   **Day 4: Versailles Gardens and Farewell Dinner**  * **Morning (9:00 AM):** Take a train to Versailles. Explore the magnificent gardens of the Palace of Versailles. Rent bikes to easily cover the vast grounds or simply stroll through the meticulously manicured lawns and fountains. Pack a vegetarian picnic or grab something from a café in the gardens. * **Afternoon (2:00 PM):**  Return to Paris and spend some time revisiting a favorite spot or exploring a neighborhood you missed. Perhaps do some souvenir shopping at a local market for unique, handcrafted items. * **Evening (6:00 PM):** Enjoy a final Parisian dinner at a restaurant that reflects your preferences for vegetarian cuisine and a local, sustainable experience. This could be a chance to try a specific type of French vegetarian dish you haven't had yet.   This itinerary offers a blend of iconic landmarks and local experiences, catering to your family's interests and preferences. Remember to check opening times and book tickets in advance where necessary, especially for the Eiffel Tower and Versailles.  Enjoy your Parisian adventure!"
New York,3,high,"[""relaxation"", ""shopping"", ""culture"", ""family""]","[""group_activities"", ""instagram_worthy""]","**Day 1: Uptown Elegance & Family Fun**  * **Morning (9:00 AM):** Begin your New York adventure with a private chauffeured car taking you directly to The Peninsula New York for check-in.  Settle into your luxurious suite and enjoy the breathtaking city views. * **Late Morning (11:00 AM):**  Private guided tour of Central Park, including a horse-drawn carriage ride through the picturesque landscapes. Capture Instagram-worthy shots at Bethesda Terrace and Fountain, Strawberry Fields, and Bow Bridge. * **Lunch (1:00 PM):** Enjoy a delightful family lunch at Tavern on the Green, a classic Central Park restaurant with stunning views and a sophisticated ambiance. * **Afternoon (2:30 PM):**  Explore the Metropolitan Museum of Art.  Focus on key highlights to avoid feeling overwhelmed, perhaps engaging a private guide for a curated experience tailored to your family's interests. * **Late Afternoon (5:00 PM):**  Relax and enjoy high tea at The Peninsula's elegant salon, a quintessential New York experience. * **Evening (7:00 PM):**  Fine dining experience at Daniel, a Michelin-starred restaurant renowned for its exquisite French cuisine and impeccable service.   **Day 2: Downtown Delights & Iconic Views**  * **Morning (9:00 AM):**  Start your day with a private helicopter tour of Manhattan. Soar above the city's iconic skyline, capturing breathtaking aerial photos for your Instagram feed. * **Late Morning (10:30 AM):**  Explore the vibrant shops and art galleries of SoHo, known for its cast-iron architecture and trendy boutiques.  Enjoy a leisurely stroll and browse high-end designer stores. * **Lunch (1:00 PM):**  Casual yet stylish lunch at Balthazar, a popular French brasserie in SoHo, offering a lively atmosphere and delicious food. * **Afternoon (2:30 PM):**  Visit the One World Observatory for panoramic views of the city.  Pre-book your tickets to avoid queues and ensure a smooth experience. * **Late Afternoon (4:30 PM):**  Take a relaxing stroll across the Brooklyn Bridge, enjoying stunning views of the Manhattan skyline. Capture memorable photos at sunset. * **Evening (7:00 PM):**  Enjoy a pre-theater cocktail at a sophisticated bar near Broadway, followed by a family-friendly Broadway show.  Consider booking premium seats for an enhanced experience.  Post-show, enjoy a celebratory dinner at a restaurant in the Theater District.   **Day 3: Culture, Shopping & Departure**  * **Morning (9:00 AM):**  Visit the American Museum of Natural History, exploring its vast collections of dinosaur fossils, planetarium, and other fascinating exhibits. Consider a guided tour for a more in-depth experience. * **Lunch (12:00 PM):** Enjoy a delicious lunch at Sarabeth's, known for its upscale comfort food and elegant atmosphere. * **Afternoon (1:30 PM):** Indulge in some high-end shopping at Fifth Avenue, browsing iconic department stores like Saks Fifth Avenue and Bergdorf Goodman. * **Late Afternoon (4:00 PM):**  Enjoy a final afternoon tea at The Plaza Hotel, a luxurious experience with stunning views and a classic New York ambiance.  Capture some Instagram-worthy photos of the iconic hotel. * **Evening (6:00 PM):**  Enjoy a final luxurious dinner at a restaurant of your choice before your private car transfers you to the airport for your departure.   This itinerary is a suggestion, and you can adjust it based on your family's preferences and energy levels. Remember to pre-book tickets and make reservations, especially for popular attractions and restaurants, to ensure a smooth and enjoyable trip.  Enjoy your luxurious New York adventure!"
Barcelona,7,low,"[""adventure"", ""shopping"", ""food""]","[""accessibility"", ""vegetarian""]","**Day 1: Arrival and Gothic Quarter Exploration**  * Arrive at Barcelona El Prat Airport (BCN). Take the Aerobus (efficient and affordable) to Plaça Catalunya.  Check into your pre-booked budget-friendly accommodation near the city center (consider hostels or budget hotels with good accessibility reviews). * Begin your exploration of the Gothic Quarter. Wander through its narrow, charming streets, admiring the architecture.  This is largely free! * Lunch: Enjoy a delicious and affordable vegetarian bocadillo (sandwich) from a local bakery. * Afternoon: Visit the Barcelona Cathedral (check for accessibility information beforehand).  Climb the stairs for panoramic city views (optional, depending on your mobility). * Evening: Explore Las Ramblas, a lively pedestrian boulevard.  Be mindful of pickpockets. Find a tapas bar offering vegetarian options for a budget-friendly dinner.  **Day 2: Park Güell and Gràcia Charm**  * Morning: Take the metro to Park Güell (purchase tickets online in advance to save time and potentially money). Explore Gaudí's whimsical park, focusing on the accessible areas.  The park's beauty is worth the visit, even if you can't explore every corner. * Lunch: Pack a vegetarian picnic lunch to enjoy in Park Güell to save on costs. * Afternoon:  Explore the Gràcia neighborhood, known for its bohemian vibe and independent shops.  Browse the unique boutiques and find some affordable souvenirs. * Evening: Enjoy a casual and affordable vegetarian dinner at a restaurant in Gràcia. Many offer set menus for better value.  **Day 3: Beach Day and Barceloneta**  * Morning: Take the metro to Barceloneta beach. Enjoy the sun, sand, and sea.  The beach itself is free! * Lunch: Grab some delicious and inexpensive vegetarian paella from a beachside takeaway or chiringuito (beach bar). * Afternoon: Stroll along Barceloneta's promenade, admiring the views.  Consider a dip in the Mediterranean Sea. * Evening:  Explore the Barceloneta area, finding a budget-friendly restaurant with vegetarian tapas.  **Day 4:  Sagrada Família and Picasso**  * Morning: Visit the Sagrada Família (book tickets online in advance to avoid queues and potentially get a discount).  While the inside is impressive, the exterior alone is a sight to behold.  Consider the accessibility information carefully before entering. * Lunch: Find a cheap and cheerful vegetarian option near the Sagrada Família. * Afternoon: Visit the Picasso Museum (check for accessibility and ticket prices in advance). Explore the works of the famous artist. * Evening: Enjoy a relaxing evening, perhaps finding a local market with affordable vegetarian street food.  **Day 5:  Montjuïc Hill and Magic Fountain**  * Morning: Take the funicular or cable car up Montjuïc Hill (consider the cost and accessibility of each option). Enjoy breathtaking panoramic views of the city. * Lunch: Pack a vegetarian picnic to enjoy at a scenic spot on Montjuïc. * Afternoon: Explore Montjuïc Castle (check accessibility and entrance fees). * Evening:  Witness the spectacular Magic Fountain show (free and accessible show, check showtimes in advance).  **Day 6:  Shopping and Culinary Delights**  * Morning: Explore the El Born neighborhood, known for its trendy shops and boutiques. Find some unique and affordable souvenirs. * Lunch:  Enjoy a budget-friendly vegetarian meal at a local eatery in El Born. * Afternoon: Visit La Boqueria Market, a vibrant food market. Sample some delicious vegetarian treats (be mindful of budget). * Evening:  Enjoy a final, affordable vegetarian dinner, perhaps trying a different neighborhood and cuisine.  **Day 7: Departure**  * Enjoy a final leisurely breakfast.  Depending on your flight time, you might have time for some last-minute souvenir shopping or a revisit to your favorite spot. * Take the Aerobus back to Barcelona El Prat Airport (BCN) for your departure.   **Important Notes:**  * This itinerary prioritizes affordability and accessibility, but always check specific accessibility information for attractions and transportation in advance. *  Utilize Barcelona's excellent public transportation system (metro and buses) to save money. Purchase a T10 travel card for cost-effective journeys. *  Book accommodation and any timed-entry attractions well in advance, especially during peak season, to secure the best prices and availability. *  Always carry a map or use a navigation app to help you get around. *  Learn a few basic Spanish phrases – it will enhance your experience.  Have a fantastic trip to Barcelona!"
New York,4,high,"[""shopping"", ""history"", ""adventure""]","[""vegetarian"", ""budget_conscious"", ""night_owl""]","**Day 1: Exploring Downtown & a Taste of History**  * **Morning (9:00 AM):** Begin your day with a private chauffeured car to take you to the Financial District.  Enjoy a leisurely stroll through Wall Street, taking in the historical architecture.  A private guided tour of the New York Stock Exchange can provide fascinating insights. * **Midday (12:00 PM):**  Lunch at a high-end vegetarian restaurant in the Financial District.  Consider a place with a focus on seasonal, locally-sourced ingredients. * **Afternoon (1:30 PM):** Immerse yourself in history with a visit to the 9/11 Memorial & Museum.  Allow ample time to reflect and explore this poignant site. Afterwards, take a ferry to Staten Island for breathtaking views of the Statue of Liberty and the Manhattan skyline – a truly unforgettable experience. * **Evening (6:00 PM):**  Enjoy a pre-dinner cocktail at a sophisticated rooftop bar in Lower Manhattan, taking in the city lights.  Dinner will be at a Michelin-starred vegetarian restaurant in the West Village, known for its innovative and elegant cuisine. * **Night (9:00 PM onwards):** Experience the vibrant nightlife of the West Village. Explore the charming streets, enjoy live jazz music at a high-end club, or simply relax at a stylish bar.   **Day 2: Uptown Elegance & Museum Hopping**  * **Morning (10:00 AM):** Start your day with a private car service to take you uptown. Begin with a visit to the Metropolitan Museum of Art, one of the world's finest art museums. Focus on sections that particularly interest you, allowing ample time for exploration. * **Midday (1:00 PM):** Enjoy a luxurious vegetarian lunch at a chic café near Central Park. * **Afternoon (2:30 PM):** Explore Central Park.  Consider a horse-drawn carriage ride through the park for a truly romantic and memorable experience. Alternatively, take a leisurely stroll, perhaps renting a bike for a more active exploration. * **Evening (6:00 PM):** Indulge in a pre-dinner cocktail at a stylish bar near the park before heading to a top-rated vegetarian restaurant on the Upper West Side known for its innovative dishes and upscale ambiance. * **Night (9:00 PM onwards):**  Catch a Broadway show.  Book tickets in advance for a premium experience. Afterwards, enjoy a late-night drink at a sophisticated bar near the theatre district.   **Day 3: Shopping Spree & High-Line Views**  * **Morning (10:00 AM):**  Begin your day with a shopping spree in SoHo, known for its high-end boutiques and designer stores.  Take your time browsing the unique shops and find some special treasures. * **Midday (1:00 PM):**  Enjoy a delicious vegetarian lunch at a trendy restaurant in SoHo.  Many offer upscale casual dining in a vibrant atmosphere. * **Afternoon (2:30 PM):** Walk the High Line, a unique elevated park built on former railway lines.  Enjoy stunning city views and the innovative public art installations along the way. * **Evening (6:00 PM):**  Enjoy a pre-dinner cocktail with panoramic views at a rooftop bar near the High Line.  Dinner will be at a critically acclaimed vegetarian restaurant in Chelsea, renowned for its creative menu and sophisticated atmosphere. * **Night (9:00 PM onwards):** Explore the vibrant nightlife of Chelsea, known for its eclectic bars and lounges.  Consider a speakeasy for a unique and intimate experience.   **Day 4:  Adventure & Departure**  * **Morning (9:00 AM):**  Embark on an adventurous helicopter tour of Manhattan. This provides unparalleled views of the city and its iconic landmarks. * **Midday (11:00 AM):** Enjoy a final luxurious vegetarian brunch at a restaurant with stunning city views. * **Afternoon (1:00 PM):** Depending on your flight schedule, you might have time for some last-minute souvenir shopping or a relaxing stroll through a park. * **Evening (4:00 PM onwards):** Private car transfer to the airport for your departure.   This itinerary prioritizes your preferences for luxury, history, adventure, and vegetarian dining, while ensuring a memorable and exciting New York City experience. Remember to book reservations and transportation in advance, especially for high-demand restaurants and activities.  Enjoy your trip!"
Rome,7,high,"[""history"", ""culture"", ""shopping""]","[""needs_breaks"", ""budget_conscious""]","**Day 1: Ancient Rome & Luxurious Relaxation**  * **Morning (9:00 AM):** Begin your Roman adventure with a private guided tour of the Colosseum and Roman Forum. Skip the long lines and delve deep into the history of the empire with an expert historian.  Enjoy the grandeur and absorb the atmosphere at your own pace. * **Lunch (1:00 PM):**  Enjoy a leisurely lunch at La Pergola, a Michelin-starred restaurant offering breathtaking panoramic views of the city.  This is a splurge, but a truly memorable culinary experience. * **Afternoon (3:00 PM):**  Relax and rejuvenate with a private spa treatment at your hotel (e.g., Hotel de Russie or The St. Regis Rome).  Enjoy a massage and unwind after your morning explorations. * **Evening (6:00 PM):**  Explore the charming Monti neighborhood, known for its artisan boutiques and trendy trattorias.  Enjoy an aperitivo at a local bar before finding a delightful dinner at a restaurant in this picturesque area.   **Day 2: Vatican City & Artistic Indulgence**  * **Morning (9:00 AM):**  A private guided tour of Vatican City, including St. Peter's Basilica and the Vatican Museums, is a must.  This ensures a smooth and enriching experience, avoiding the crowds.  Focus on the Sistine Chapel and Raphael Rooms. * **Lunch (1:00 PM):**  Enjoy a refined lunch at Borghiciana Pastificio Artigianale near the Vatican, known for its delicious handmade pasta. * **Afternoon (3:00 PM):** Immerse yourself in art at the Borghese Gallery and Museum.  Pre-booked tickets are essential.  Admire masterpieces by Bernini and Caravaggio, and take a relaxing stroll through the beautiful Borghese Gardens afterwards. * **Evening (6:00 PM):** Indulge in a high-end shopping experience at Via Condotti, known for its designer boutiques. Enjoy a sophisticated dinner at a restaurant in the area.   **Day 3:  Trevi Fountain, Pantheon & Spanish Steps**  * **Morning (9:00 AM):** Start your day with a visit to the Trevi Fountain early to avoid the largest crowds. Toss a coin and admire the Baroque masterpiece. Afterwards, explore the Pantheon, marveling at its architectural genius. * **Lunch (1:00 PM):** Enjoy a delicious and authentic Roman lunch at Armando al Pantheon, a traditional trattoria near the Pantheon. * **Afternoon (2:30 PM):** Climb the Spanish Steps, enjoying the views from the top. Explore the surrounding area, including the Piazza di Spagna and the Keats-Shelley House. * **Evening (6:00 PM):** Take a cooking class and learn to prepare some classic Roman dishes. This offers a fun and interactive cultural experience, followed by enjoying the fruits of your labor.   **Day 4:  Day Trip to Florence**  * **Morning (7:00 AM):** Take a high-speed train to Florence for a day trip.  Enjoy the convenience and speed of private train transfer service. * **Morning/Afternoon (8:00 AM - 5:00 PM):** Explore Florence's highlights: the Duomo, Uffizi Gallery, Ponte Vecchio. Consider a private guide for a more personalized experience.  Enjoy lunch in Florence. * **Evening (7:00 PM):** Return to Rome by high-speed train and enjoy a relaxed dinner near your hotel.   **Day 5:  Appian Way & Catacombs Exploration**  * **Morning (9:00 AM):** Explore the ancient Appian Way by bike or on a guided tour. This offers a unique perspective on Roman history, away from the city center.  Enjoy the serene landscape and historical sites along the way. * **Lunch (1:00 PM):** Have a picnic lunch amidst the scenic beauty of the Appian Way. * **Afternoon (3:00 PM):** Visit the Catacombs of Callixtus or Domitilla, offering a glimpse into early Christian history. * **Evening (6:00 PM):** Enjoy a delightful dinner in the Testaccio neighborhood, known for its authentic Roman cuisine and lively atmosphere.   **Day 6:  Castel Sant'Angelo & Trastevere Charm**  * **Morning (9:00 AM):** Visit Castel Sant'Angelo, a fascinating fortress with stunning views of the city. Explore its history and admire the architecture. * **Lunch (1:00 PM):** Enjoy lunch at a restaurant near Castel Sant'Angelo, savoring the Roman ambiance. * **Afternoon (3"
