destination,duration,budget,core_prefs,special_prefs,itinerary
Rome,4,low,"[""nightlife"", ""relaxation""]","[""vegetarian"", ""needs_breaks""]","**Day 1: Trastevere Charm & Evening Buzz**  * **Morning (Relaxation & Exploration):** Start your day with a leisurely stroll through the charming neighborhood of Trastevere.  Get lost in its narrow, cobblestone streets, admiring the colorful buildings and vibrant atmosphere.  Find a quiet spot in a small piazza for a relaxing break, people-watching and soaking in the Roman ambiance.  Grab a delicious and affordable *cornetto* (pastry) and cappuccino from a local bakery for breakfast. * **Afternoon (Budget-Friendly Sightseeing):** Visit the Basilica di Santa Maria in Trastevere, a beautiful church with stunning mosaics.  Afterwards, wander along the Tiber River, enjoying the views.  Take your time, find a bench to rest, and simply enjoy the scenery. This is a perfect moment to recharge. * **Evening (Nightlife & Vegetarian Delight):**  As evening approaches, explore Trastevere's lively nightlife. Many trattorias offer vegetarian options at reasonable prices. Enjoy a delicious and affordable Roman dinner at a *trattoria* in Trastevere, savoring the authentic atmosphere. Afterwards, experience Trastevere's vibrant nightlife; enjoy a drink at a local bar or explore the area's many pubs and clubs.  **Day 2: Ancient Wonders & Peaceful Retreats**  * **Morning (Ancient History & Relaxation):** Begin your day with a visit to the Colosseum and Roman Forum.  While entry fees apply, consider visiting early in the morning to beat the crowds and the heat.  Afterwards, find a peaceful spot in the nearby park, such as the Villa Borghese gardens, to relax and enjoy a picnic lunch with some bread, cheese, and fruit you purchased from a local market – a budget-friendly and delicious option. * **Afternoon (Relaxation & Exploration):** Spend the afternoon relaxing in the Villa Borghese gardens.  Take a stroll, find a shady spot to rest, or rent a rowboat on the lake – a surprisingly affordable and relaxing activity.  Consider visiting the Galleria Borghese (entry fee applies, but it’s worth it for art enthusiasts), but remember to book tickets in advance. * **Evening (Budget-Friendly Dinner & Nightlife):** Head back towards the city center and find a vegetarian-friendly pizzeria for a budget-friendly dinner.  Many offer delicious slices for a quick and affordable meal.  Afterwards, you can explore the Monti neighborhood, known for its trendy bars and pubs, offering a different nightlife experience compared to Trastevere.  **Day 3: Vatican City & Artistic Exploration**  * **Morning (Vatican City & Relaxation):**  Visit Vatican City, home to St. Peter's Basilica and the Vatican Museums.  While entry to the museums is not free, you can visit St. Peter's Basilica for free.  Allocate ample time for exploring the Basilica, and if you choose to enter the museums, prioritize what interests you most to manage your time and energy effectively. Remember to schedule breaks throughout the day. * **Afternoon (Artistic Exploration & Relaxation):**  Explore the charming neighborhood of Borgo, located near Vatican City.  You can find many smaller churches and hidden gems to discover.  Consider finding a quiet café for a coffee break and to simply unwind. * **Evening (Vegetarian Food & Relaxed Evening):** Enjoy dinner at a vegetarian-friendly restaurant near your accommodation.  Choose a place with a relaxed atmosphere to unwind after a day of sightseeing.  You could enjoy a quiet evening in, or perhaps find a local park for a relaxing evening stroll.   **Day 4:  Hidden Gems & Departure**  * **Morning (Hidden Gems & Relaxation):** Discover some of Rome's hidden gems.  Explore the quieter neighborhoods like Testaccio or the Appian Way Regional Park (consider cycling along sections of the Appian Way if you like).  Remember to take regular breaks throughout the day. * **Afternoon (Last Bites & Souvenir Shopping):** Enjoy a final Roman lunch at a local market or a takeaway place.  Spend some time souvenir shopping, perhaps focusing on affordable options like postcards or small artisan crafts. * **Evening: Departure:**  Depending on your flight schedule, enjoy one last gelato before heading to the airport.   **Important Notes:**  * **Transportation:** Utilize Rome's public transport system (metro and buses) – it's affordable and efficient. Purchase a day or multi-day pass for cost savings. * **Vegetarian Options:**  Many restaurants in Rome cater to vegetarians; look for places that advertise ""vegetariano"" on their menus. * **Hydration:** Carry a reusable water bottle and refill it throughout the day to stay hydrated, especially during warmer months. * **Breaks:**  Schedule regular breaks throughout your sightseeing to avoid exhaustion. Find parks, pia"
Istanbul,7,medium,"[""food"", ""culture"", ""nature""]","[""sustainable"", ""accessibility""]","**Day 1: Arrival and Sultanahmet Exploration**  * Arrive at Istanbul Airport (IST), take the Havabus (airport shuttle bus) to Taksim Square for a budget-friendly and accessible transfer. Check into your hotel in Sultanahmet – a centrally located area with many accessible options. * Afternoon: Explore Sultanahmet Square, visiting the Hippodrome (free entry), the Blue Mosque (free entry, dress modestly), and Hagia Sophia (entry fee applies, book tickets online to avoid queues).  Consider a guided walking tour focusing on the area's history and architecture for a richer experience. * Evening: Enjoy a delicious and affordable Turkish dinner at a local ""lokanta"" (traditional restaurant) in Sultanahmet.  Many offer vegetarian and gluten-free options.  Afterwards, enjoy a relaxing stroll along the Gülhane Park, offering beautiful views of the Bosphorus.   **Day 2: Topkapi Palace and Grand Bazaar Immersion**  * Morning: Visit Topkapi Palace (entry fee applies, pre-booking recommended), the opulent former residence of Ottoman sultans.  Allocate ample time to explore the extensive grounds and Harem section.  Wheelchair access is available in most areas, but some sections may be challenging. * Afternoon: Immerse yourself in the vibrant atmosphere of the Grand Bazaar.  Engage with local artisans, haggle respectfully for souvenirs, and take breaks at traditional tea houses.  Be mindful of crowds and plan your route in advance for easier navigation. * Evening: Savor a traditional Turkish cooking class, learning to prepare classic dishes.  This offers a sustainable and cultural experience, supporting local businesses and engaging directly with the community.  Many classes cater to dietary restrictions.   **Day 3: Bosphorus Cruise and Balat Exploration**  * Morning: Take a scenic Bosphorus cruise (various options available, choose a reputable company with accessible boats).  Enjoy stunning views of Istanbul's skyline, historical landmarks, and charming waterfront neighborhoods.  Many cruises offer commentary in multiple languages. * Afternoon: Explore the charming and colorful Balat neighborhood, known for its historic synagogues, churches, and colorful houses.  Wander through its narrow streets, discover hidden cafes, and enjoy the peaceful atmosphere.  This area is relatively walkable, but be aware of uneven pavements. * Evening: Indulge in a delicious and reasonably priced seafood dinner at a restaurant along the Golden Horn.  Many offer outdoor seating with picturesque views.   **Day 4: Süleymaniye Mosque and Spice Bazaar Delights**  * Morning: Visit the magnificent Süleymaniye Mosque (free entry, dress modestly), another architectural masterpiece designed by the renowned architect Sinan.  Enjoy the peaceful atmosphere and admire the intricate details. * Afternoon: Explore the vibrant and aromatic Spice Bazaar (Egyptian Bazaar), a sensory overload of colorful spices, teas, and Turkish delights.  Purchase souvenirs and sample local treats.  Remember to haggle respectfully and be mindful of the crowds. * Evening: Enjoy a traditional Turkish ""meyhane"" experience (tavern) with live music and delicious ""meze"" (appetizers). This offers a taste of local nightlife in a vibrant atmosphere.   **Day 5:  Green Escape to Pierre Loti Hill & Eyüp**  * Morning: Take a tram or funicular to Pierre Loti Hill for panoramic views of the Golden Horn and the city.  Enjoy the peaceful atmosphere and the unique perspective. The funicular offers good accessibility. * Afternoon: Explore the historic Eyüp neighborhood, known for its mosque and bustling market.  Visit the Eyüp Sultan Mosque and its surrounding area.  This provides a glimpse into a quieter, more local side of Istanbul. * Evening:  Enjoy a relaxing dinner at a restaurant in Eyüp, sampling local specialties.  Many restaurants offer outdoor seating with pleasant views of the area.   **Day 6:  Chora Church and Gülhane Park Relaxation**  * Morning: Visit the Chora Church (Kariye Museum) (entry fee applies), renowned for its stunning Byzantine mosaics and frescoes.  Pre-booking tickets is recommended to avoid queues.  The church has limited accessibility, so check beforehand. * Afternoon: Spend the afternoon relaxing in Gülhane Park, enjoying the greenery, historical structures, and beautiful views of the Bosphorus. This offers a peaceful escape from the bustling city center. * Evening:  Enjoy a farewell dinner at a restaurant with a view, celebrating your Istanbul adventure. Consider a rooftop restaurant for stunning city views.   **Day 7: Departure**  * Enjoy a final Turkish breakfast before heading to Istanbul Airport (IST) via Havabus or taxi, depending on your flight schedule.   This itinerary is a suggestion and can be customized to your preferences and energy levels. Remember to check opening hours and entry fees for attractions in"
Bali,4,medium,"[""relaxation"", ""family""]","[""instagram_worthy"", ""needs_breaks""]","**Day 1: Arrival and Ubud's Artistic Charm**  * **Morning (8:00 AM):** Arrive at Denpasar Airport (DPS).  Pre-booked private transfer to your hotel in Ubud (approx. 1.5-hour drive). Opt for a comfortable car with AC for a relaxing start.  Consider a hotel with a pool for those needed breaks. * **Late Morning (10:00 AM):** Check into your hotel and freshen up. * **Afternoon (12:00 PM):** Lunch at a local Warung in Ubud.  Try Nasi Campur for an authentic Balinese experience. * **Afternoon (2:00 PM):** Explore the Tegalalang Rice Terraces.  This iconic location offers stunning views perfect for Instagram-worthy photos. Take your time, enjoy the scenery, and find a quiet spot for a break. * **Late Afternoon (4:00 PM):** Visit a coffee plantation and participate in a Luwak coffee tasting session.  Learn about the unique coffee-making process. * **Evening (6:00 PM):** Relax by the hotel pool or enjoy a traditional Balinese massage. * **Evening (8:00 PM):** Dinner at a restaurant in Ubud offering delicious Indonesian cuisine with a modern twist.   **Day 2: Spiritual Ubud and Artistic Exploration**  * **Morning (8:00 AM):** Start your day with a visit to the Sacred Monkey Forest Sanctuary. Remember to protect your belongings from the playful monkeys! * **Late Morning (10:00 AM):** Explore Ubud Palace and Ubud Art Market.  The Palace is a beautiful example of Balinese architecture, while the market offers a vibrant array of handicrafts and souvenirs.  Take your time browsing, but be prepared to negotiate prices. * **Afternoon (12:00 PM):** Enjoy lunch at a casual restaurant near the market. * **Afternoon (1:30 PM):**  Visit a local artist's studio or gallery to appreciate Balinese art.  This is a great opportunity to learn more about the local culture and perhaps even purchase a unique piece of art. * **Late Afternoon (4:00 PM):** Relax and unwind at your hotel. Take a dip in the pool or enjoy a quiet moment reading a book. * **Evening (6:00 PM):** Enjoy a delightful dinner at a restaurant with stunning views of the rice paddies.   **Day 3: Beach Bliss in Seminyak**  * **Morning (8:00 AM):** Enjoy a leisurely breakfast at your hotel. * **Morning (9:00 AM):**  Check out of your hotel and take a private transfer to Seminyak (approx. 1-hour drive). * **Late Morning (10:00 AM):** Check into your beachfront hotel in Seminyak. Spend some time relaxing by the pool or on the beach. * **Afternoon (12:00 PM):** Lunch at a beachfront café enjoying the ocean breeze. * **Afternoon (2:00 PM):** Spend the afternoon relaxing on Seminyak Beach.  Swim in the ocean, soak up the sun, or simply enjoy the beautiful surroundings. Take some Instagram-worthy photos of the sunset. * **Evening (6:00 PM):** Enjoy dinner at a trendy restaurant in Seminyak. Consider a restaurant with live music for a more vibrant experience.   **Day 4: Departure**  * **Morning (8:00 AM):** Enjoy a final Balinese breakfast. * **Morning (9:00 AM):**  Spend some time relaxing by the pool or on the beach before checking out.  Perhaps do some last-minute souvenir shopping. * **Afternoon (12:00 PM):** Check out of your hotel and enjoy a final delicious lunch. * **Afternoon (2:00 PM):**  Private transfer to Denpasar Airport for your departure.  Allow ample time for check-in and security procedures.   This itinerary balances relaxation with cultural experiences, ensuring you have ample opportunities for breaks and capturing Instagram-worthy moments. Remember to book accommodations and transfers in advance, especially during peak season.  Enjoy your Balinese family getaway!"
Paris,3,medium,"[""family"", ""relaxation"", ""nightlife"", ""culture""]","[""local_experience"", ""sustainable""]","**Day 1: Parisian Charm & Evening Lights**  * **Morning (9:00 AM):** Start your day with a leisurely stroll through the charming Marais district.  Explore its picturesque streets, admire the architecture, and browse the unique boutiques.  Grab a delicious and affordable croissant and café au lait from a local boulangerie for breakfast.  * **Mid-morning (10:30 AM):** Visit the Picasso Museum, showcasing a vast collection of the artist's works.  Pre-booking tickets online is recommended to avoid queues.  * **Lunch (12:30 PM):** Enjoy a picnic lunch in the beautiful Place des Vosges, the oldest planned square in Paris.  Pick up some delicious sandwiches and fresh produce from a local market nearby.  * **Afternoon (2:00 PM):** Take a relaxing boat tour along the Seine River. This offers stunning views of iconic landmarks like the Eiffel Tower and Notre Dame Cathedral, from a sustainable and unique perspective.  * **Late Afternoon (4:00 PM):** Explore the Latin Quarter, known for its student atmosphere and historical significance. Visit the Sorbonne University and wander through the Shakespeare and Company bookstore.  * **Evening (6:00 PM):** Enjoy a delicious and reasonably priced dinner at a traditional French bistro in the Latin Quarter.  Many offer classic dishes and a lively atmosphere.  * **Night (8:00 PM):** Experience Parisian nightlife with a family-friendly evening walk along the Seine, enjoying the illuminated city.  Consider a gentle evening cruise if time and budget allow.   **Day 2: Iconic Landmarks & Local Flavors**  * **Morning (9:00 AM):** Visit the Eiffel Tower. Pre-book your tickets to avoid long lines and consider taking the stairs for a more sustainable and engaging experience (if physically able). Enjoy the breathtaking panoramic views from the top.  * **Late Morning (11:00 AM):** Take a guided walking tour of the Champ de Mars, learning about the history and significance of this iconic park.  Choose a smaller, local tour operator for a more intimate experience.  * **Lunch (1:00 PM):**  Enjoy a casual lunch at a crêperie near the Eiffel Tower.  Crêpes offer a delicious and affordable option.  * **Afternoon (2:30 PM):** Visit the Louvre Museum. Focus on key masterpieces like the Mona Lisa and Venus de Milo to manage time effectively. Pre-booking tickets is essential.  * **Late Afternoon (5:00 PM):**  Explore the Tuileries Garden, a beautiful formal garden connecting the Louvre to Place de la Concorde. Relax and enjoy the peaceful atmosphere.  * **Evening (7:00 PM):** Participate in a cooking class focusing on classic French cuisine. This provides a unique cultural experience and a delicious meal.  Many options cater to different skill levels and budgets.  * **Night (9:00 PM):** Enjoy a relaxed evening back at your accommodation or a nearby café, reflecting on the day's adventures.   **Day 3: Montmartre Charm & Farewell Dinner**  * **Morning (9:00 AM):**  Take the metro to Montmartre, the artistic heart of Paris. Explore the charming streets, admire the Sacré-Cœur Basilica, and soak in the bohemian atmosphere.  * **Mid-morning (10:30 AM):** Visit the Musée de Montmartre, dedicated to the history of the area and its artistic legacy.  * **Lunch (12:00 PM):** Enjoy lunch at a traditional French restaurant in Montmartre, savouring the local cuisine and atmosphere.  Look for places with outdoor seating for a pleasant experience.  * **Afternoon (1:30 PM):**  Wander through the Place du Tertre, where artists create and sell their work.  It’s a great place to find a unique souvenir.  * **Late Afternoon (3:00 PM):** Take a leisurely walk through the Parc des Buttes-Chaumont, a romantic park with bridges, waterfalls, and stunning city views.  * **Evening (6:00 PM):** Enjoy a farewell dinner at a restaurant in a neighbourhood you particularly enjoyed during your stay. This allows you to revisit a favourite spot and savour the last moments of your Parisian adventure.  Consider a restaurant with a view for a memorable final meal.  * **Night (8:00 PM):**  Enjoy a final stroll, perhaps revisiting a favourite location, before heading back to your accommodation.   This itinerary offers a blend of iconic landmarks, local experiences, relaxation, and cultural immersion, all within a medium budget and with consideration for sustainable choices. Remember to utilize the efficient Paris Metro system for transportation.  Enjoy your trip!"
Bangkok,4,high,"[""history"", ""relaxation""]","[""early_riser"", ""budget_conscious""]","**Day 1: Immersive Royal Grandeur and Serene Sunset**  * **6:00 AM:** Begin your day with a private guided tour of the Grand Palace and Wat Phra Kaew (Temple of the Emerald Buddha).  Avoid the midday crowds and experience the serenity of these iconic sites at dawn. Your guide will share fascinating historical details, bypassing long queues thanks to pre-arranged access. * **9:00 AM:** Enjoy a leisurely breakfast at a luxurious hotel – perhaps the Mandarin Oriental Bangkok – known for its exquisite views and refined ambiance. * **10:30 AM:** Take a private longtail boat ride along the Chao Phraya River, witnessing the city awaken from a unique perspective.  This offers a relaxing contrast to the historical sites. * **12:00 PM:**  Indulge in a delicious and refined lunch at a riverside restaurant with stunning views. * **1:30 PM:** Check into your luxurious hotel (e.g., The Peninsula Bangkok or Siam Kempinski Hotel Bangkok). Relax by the pool or indulge in a spa treatment. * **5:00 PM:** Enjoy a private rooftop cocktail experience at a high-end bar overlooking the city, savoring the sunset. * **7:00 PM:**  Dine at a Michelin-recommended restaurant offering authentic Thai cuisine with a modern twist.   **Day 2:  Ancient Wonders and Artistic Exploration**  * **6:30 AM:**  Start with a private transfer to Ayutthaya, the former capital of Siam, a UNESCO World Heritage site.  Employ a private car and driver for comfort and efficiency. * **7:30 AM:** Explore the magnificent temples and ruins of Ayutthaya with a knowledgeable private guide.  Focus on key sites like Wat Yai Chaimongkol and Wat Phra Sri Sanphet.  The early start ensures fewer crowds. * **12:00 PM:**  Enjoy a refined lunch at a restaurant in Ayutthaya known for its traditional Thai cuisine. * **1:30 PM:** Continue exploring Ayutthaya at your own pace, perhaps renting bicycles for a more immersive experience. * **4:00 PM:** Return to Bangkok by private car. * **6:00 PM:**  Relax and unwind at your hotel. * **8:00 PM:** Experience a traditional Thai massage at a reputable spa within your hotel or a high-end spa known for its authentic treatments.   **Day 3:  Markets, Museums and Cultural Immersion**  * **7:00 AM:** Visit a local market early in the morning – perhaps a less touristy one recommended by your hotel concierge – to witness the bustling atmosphere and experience the authentic energy of Bangkok.  This offers a glimpse into daily life. * **8:30 AM:** Explore the Jim Thompson House Museum, a fascinating showcase of traditional Thai architecture and art. * **10:00 AM:** Immerse yourself in art at the Bangkok National Museum, showcasing Thailand's rich history through its extensive collection. * **12:00 PM:** Enjoy a fine dining experience at a restaurant known for its refined ambiance and exquisite presentation. * **1:30 PM:** Spend the afternoon relaxing by the hotel pool or indulging in another spa treatment. * **5:00 PM:** Enjoy a leisurely stroll through Lumpini Park, Bangkok's green lung, offering a tranquil escape from the city bustle. * **7:00 PM:**  Dine at a restaurant of your choice, perhaps exploring a different culinary style.   **Day 4:  Departure and Last Glimpses**  * **7:00 AM:** Enjoy a final luxurious breakfast at your hotel. * **8:00 AM:** Depending on your flight schedule, consider a final visit to a temple or market you particularly enjoyed, or simply relax and soak in the atmosphere. * **10:00 AM:**  Private transfer to Suvarnabhumi Airport for your departure, allowing ample time for check-in and security.   This itinerary prioritizes your interests in history and relaxation, while respecting your preference for early starts and a high budget. Remember to confirm all bookings and transportation arrangements in advance.  Enjoy your trip to Bangkok!"
