destination,duration,budget,core_prefs,special_prefs,itinerary
Bali,4,medium,"[""food"", ""nightlife""]","[""instagram_worthy"", ""group_activities""]","**Day 1: Seminyak Sunset & Beach Club Vibes**  * **Morning (9:00 AM):** Start your Balinese adventure with a delicious brunch at Kynd Community, known for its Instagram-worthy smoothie bowls and healthy options.  Afterwards, explore the trendy boutiques and shops along Seminyak's Oberoi Street. * **Afternoon (1:00 PM):**  Enjoy a casual lunch at a Warung (local eatery) for authentic Indonesian cuisine at a fraction of the cost.  Try Nasi Goreng or Mie Goreng for a classic taste of Bali. * **Late Afternoon (3:00 PM):** Head to La Favela Bali for a unique and visually stunning dining experience. This restaurant is a hidden gem with a jungle-like atmosphere, perfect for those memorable Instagram shots. * **Evening (6:00 PM):** Relax and soak up the sunset at Potato Head Beach Club. Enjoy the vibrant atmosphere, delicious cocktails, and stunning ocean views. This is a great spot for people-watching and capturing beautiful sunset photos. * **Night (9:00 PM):** Experience Seminyak's nightlife by joining a group pub crawl or exploring the many bars and clubs along Jalan Oberoi.  Consider a cocktail-making class for a fun and interactive experience.   **Day 2: Cultural Immersion & Rice Paddy Views**  * **Morning (8:00 AM):** Take a guided tour to Tegalalang Rice Terraces.  This iconic location offers breathtaking views and plenty of opportunities for stunning photos.  Many tour operators offer group packages including transportation. * **Afternoon (12:00 PM):** Enjoy a traditional Balinese lunch at a local warung near the rice terraces.  This is a chance to sample authentic dishes in a picturesque setting. * **Afternoon (2:00 PM):** Visit a coffee plantation and participate in a Luwak coffee tasting. Learn about the unique coffee-making process and enjoy the beautiful scenery. * **Late Afternoon (4:00 PM):** Explore Ubud Monkey Forest, a sanctuary home to hundreds of playful monkeys. Remember to keep your belongings secure! * **Evening (6:00 PM):** Enjoy dinner at a restaurant in Ubud, choosing from a variety of options to suit your taste.  Consider a restaurant with traditional Balinese dance performances for a cultural experience.   **Day 3: Uluwatu Temple & Beach Bliss**  * **Morning (9:00 AM):**  Take a day trip to Uluwatu Temple, a stunning clifftop temple with breathtaking ocean views.  Many tour operators offer group tours that include transportation and entrance fees. * **Afternoon (12:00 PM):** Enjoy lunch at a casual restaurant near Uluwatu Temple, taking in the views. * **Afternoon (1:30 PM):** Spend the afternoon relaxing on one of the beautiful beaches near Uluwatu, such as Padang Padang Beach or Bingin Beach. These beaches are known for their dramatic cliffs and crystal-clear water, perfect for Instagram-worthy photos. * **Evening (6:00 PM):** Witness the Kecak dance performance at Uluwatu Temple against the backdrop of the setting sun. This is a truly unforgettable cultural experience. * **Night (8:00 PM):** Enjoy dinner at a restaurant in Jimbaran Bay, known for its fresh seafood and romantic beachfront settings.   **Day 4:  Shopping & Departure**  * **Morning (9:00 AM):** Spend the morning shopping for souvenirs and local handicrafts at the Sukawati Art Market.  Bargaining is expected! * **Afternoon (12:00 PM):** Enjoy a final Balinese lunch at a restaurant of your choice. This could be a chance to revisit a favourite spot or try something new. * **Afternoon (2:00 PM):** Relax by the pool at your hotel or enjoy a final swim in the ocean before heading to the airport. * **Evening (depending on flight schedule):** Depart from Denpasar Airport (DPS).   This itinerary is a suggestion and can be adapted to your preferences. Remember to factor in travel time between locations and book tours and transportation in advance, especially during peak season.  Enjoy your trip to Bali!"
Bali,5,low,"[""nightlife"", ""family"", ""history"", ""relaxation""]","[""local_experience"", ""group_activities""]","**Day 1: Arrival and Seminyak Sunset**  * Arrive at Denpasar Airport (DPS). Take the Airport Kura-Kura Bus to your pre-booked budget-friendly guesthouse or homestay in Seminyak.  These offer a good balance of price and location. * Settle in and grab some delicious and affordable street food for lunch – try Nasi Goreng or Mie Goreng from a local warung (small restaurant). * Spend the afternoon relaxing on Seminyak Beach. Enjoy the sunset – it's truly spectacular. * In the evening, experience Seminyak's vibrant nightlife.  Enjoy a few affordable Bintang beers at a beach bar or explore the La Favela for a unique, lively atmosphere (remember to be mindful of your budget).   **Day 2: Cultural Immersion and Beach Fun**  * Start your day with a visit to Tanah Lot Temple, a stunning sea temple perched on a rock formation.  Take a local bus to get there – it's a much cheaper option than a taxi.  Enjoy the beautiful scenery and learn about the temple's history. * After Tanah Lot, head to Kuta Beach. This is a great place for surfing lessons (many affordable options are available) or simply relaxing on the sand. * For dinner, explore the food stalls around Kuta Beach.  You'll find a wide variety of delicious and inexpensive Indonesian dishes.  This is a fantastic opportunity for a local experience. * In the evening, consider joining a group beach bonfire – many hotels and guesthouses organize these, providing a chance to meet fellow travelers.   **Day 3: Ubud's Artistic Heart and Rice Terraces**  * Take an early morning bus to Ubud. This journey offers a glimpse into Balinese countryside life. * Upon arrival, explore Ubud's art market. You can find unique souvenirs and handicrafts at affordable prices, although bargaining is expected. * Spend the afternoon visiting Tegalalang Rice Terraces.  This iconic location provides breathtaking views and plenty of photo opportunities.  You can even consider a short, guided walk through the terraces for a more immersive experience (look for group tours for better value). * In the evening, enjoy a traditional Balinese dance performance in Ubud. Many affordable options are available, offering a captivating glimpse into Balinese culture.   **Day 4: Family Fun and Waterfalls**  * Take a day trip to visit Tegenungan Waterfall.  This is a beautiful waterfall where you can swim in the refreshing water (check safety guidelines before entering).  You can take a local bus or hire a driver to share with other tourists to save costs. * Afterwards, explore the surrounding area, perhaps visiting a local coffee plantation where you can learn about the coffee-making process and sample Luwak coffee (optional, it can be pricey). * In the afternoon, head back to your accommodation, allowing time for relaxation and family bonding.  Perhaps prepare a simple meal together using ingredients from a local market.   **Day 5: Departure**  * Enjoy a final Balinese breakfast at your guesthouse or a local warung. * Depending on your flight schedule, you might have time for some last-minute souvenir shopping or a final stroll along the beach. * Take the Airport Kura-Kura Bus back to Denpasar Airport for your departure.   **Important Notes:**  * This itinerary is a suggestion and can be adjusted based on your preferences and energy levels. * Always negotiate prices, especially with taxi drivers and souvenir sellers. * Stay hydrated and use sunscreen, especially during the day. * Respect local customs and traditions. * Download a translation app and offline maps to help you navigate.  Have a wonderful trip to Bali!"
Rome,7,high,"[""nightlife"", ""adventure"", ""family""]","[""night_owl"", ""sustainable""]","**Day 1: Arrival and Trastevere Charm**  * Arrive at Fiumicino Airport (FCO).  Arrange for a private car transfer to your luxurious hotel in the Monti neighborhood, known for its charming streets and proximity to major attractions.  Consider Hotel de Russie or The St. Regis Rome. * Settle in and enjoy a leisurely afternoon exploring the Monti neighborhood.  Browse the artisan shops and soak in the atmosphere. * Evening:  Enjoy an aperitivo at a stylish rooftop bar overlooking the city, followed by a delicious dinner at a traditional Trattoria in Trastevere.  Afterwards, experience Trastevere's vibrant nightlife – explore its charming squares and lively bars.  Consider booking a private guided walking tour of Trastevere's hidden alleyways and historical sites to enhance your evening.  **Day 2: Ancient Rome and Underground Exploration**  * Morning:  Private guided tour of the Colosseum and Roman Forum, skipping the lines and gaining exclusive access to less-crowded areas.  Your guide will provide fascinating historical context. * Lunch: Enjoy a gourmet lunch at a restaurant near the Colosseum, savoring authentic Roman cuisine. * Afternoon:  Embark on a unique adventure: a guided tour of the Roman Catacombs.  This subterranean exploration offers a fascinating glimpse into early Christian history. * Evening:  Indulge in a fine dining experience at a Michelin-starred restaurant.  Consider La Pergola or Imàgo for breathtaking views alongside exceptional cuisine. Afterwards, enjoy a post-dinner drink at a sophisticated bar.  **Day 3: Vatican City and Artistic Wonders**  * Morning:  Private guided tour of Vatican City, including St. Peter's Basilica and the Vatican Museums, ensuring priority access to the Sistine Chapel.  Your guide will share insightful information about the art and history. * Lunch:  Enjoy a refined lunch at a restaurant near the Vatican. * Afternoon:  Explore the charming Borgo neighborhood, adjacent to Vatican City.  Visit Castel Sant'Angelo, offering panoramic views of the city. * Evening:  Attend an opera performance at the Teatro dell'Opera di Roma for a truly immersive cultural experience.  Afterwards, enjoy a late-night drink at a stylish bar.  **Day 4:  Family Fun and Culinary Delights**  * Morning:  Spend the morning at the Bioparco di Roma, a sustainable zoo offering a fun and educational experience for the whole family. * Lunch:  Enjoy a relaxed lunch at a family-friendly restaurant near the zoo. * Afternoon:  Take a cooking class focusing on authentic Roman cuisine. This hands-on experience will be enjoyable for all ages and provide a lasting memory. * Evening:  Enjoy a pizza-making experience followed by dinner at a traditional pizzeria. Afterward, enjoy gelato at a local gelateria.  **Day 5:  Appian Way Adventure and Sustainable Exploration**  * Morning:  Rent electric bikes and explore the ancient Appian Way, a scenic route offering a blend of history and nature.  This sustainable option allows you to enjoy the scenery at your own pace. * Lunch:  Enjoy a picnic lunch amidst the beautiful scenery along the Appian Way. * Afternoon:  Visit the Baths of Caracalla, exploring the impressive ruins of these ancient Roman baths. * Evening:  Enjoy a sunset aperitivo followed by dinner at a restaurant in the Testaccio Market area, known for its vibrant atmosphere and sustainable food options.  **Day 6:  Shopping and Relaxation**  * Morning:  Explore the high-end shops along Via Condotti and Via del Babuino. * Lunch:  Enjoy a luxurious lunch at a café near the Spanish Steps. * Afternoon:  Relax and rejuvenate with a spa treatment at your hotel or a luxurious spa in the city. * Evening:  Enjoy a farewell dinner at a rooftop restaurant offering spectacular views of the Roman skyline.  **Day 7: Departure**  * Enjoy a final Roman breakfast at your hotel. * Depending on your flight schedule, you might have time for some last-minute souvenir shopping or a final stroll through your favorite neighborhood. * Private car transfer to Fiumicino Airport for your departure.   This itinerary offers a blend of historical exploration, cultural immersion, family fun, and luxurious experiences, tailored to your preferences and ensuring a memorable Roman holiday. Remember to book tours and restaurants in advance, especially during peak season.  Enjoy your trip!"
Rome,3,low,"[""nature"", ""relaxation"", ""food"", ""history""]","[""group_activities"", ""vegetarian"", ""accessibility""]","**Day 1: Ancient Wonders & Green Escapes**  * **Morning (9:00 AM):** Start your Roman adventure at the Colosseum and Roman Forum.  Purchase tickets online in advance to potentially save time and money.  Consider a free walking tour that focuses on accessibility; many companies offer these, and tips are optional.  The combination of history and the scale of these sites is breathtaking.  * **Lunch (1:00 PM):** Enjoy a delicious and affordable vegetarian pizza al taglio (pizza by the slice) from a local pizzeria near the Forum.  Many offer a wide variety of toppings, ensuring plenty of vegetarian options.  * **Afternoon (2:30 PM):** Escape the city buzz with a relaxing visit to the Parco degli Acquedotti. This park boasts stunning views of ancient aqueducts, offering a tranquil environment for a stroll or simply enjoying the greenery.  It's easily accessible by public transport (bus).  * **Evening (6:00 PM):** Head to the Monti neighborhood, known for its charming streets and trattorias.  Find a vegetarian-friendly restaurant offering a traditional Roman dinner at a budget-friendly price.  Look for ""menu turistico"" options for value.  * **Night (8:00 PM):** Enjoy a leisurely evening stroll through Monti, taking in the ambiance.  Many smaller streets have beautiful lighting, offering a pleasant end to the day.   **Day 2: Vatican City & Trastevere Charm**  * **Morning (9:00 AM):** Visit Vatican City.  Pre-book your tickets to the Vatican Museums and St. Peter's Basilica online to avoid long queues.  Focus on key highlights like the Sistine Chapel to make the most of your time. Consider a group tour if you prefer guided exploration. Many tours offer vegetarian-friendly lunch options, but pack snacks to save money.  * **Lunch (1:00 PM):** Grab a quick and cheap vegetarian lunch near the Vatican.  There are many street food options available, such as supplì (fried rice balls) or panini from local shops.  * **Afternoon (2:30 PM):** Take the bus or metro to Trastevere, a picturesque neighborhood known for its cobblestone streets and lively atmosphere.  Explore the charming alleys, browse artisan shops, and soak in the bohemian vibe.  * **Evening (6:00 PM):** Enjoy dinner in Trastevere.  This area offers a wide range of restaurants, including several with vegetarian options.  Look for trattorias or pizzerias away from the main tourist streets for better value.  * **Night (8:00 PM):**  Enjoy a relaxing evening walk along the Tiber River or find a local pub for a drink (optional).   **Day 3:  Appian Way & Hidden Gems**  * **Morning (9:00 AM):** Explore the ancient Appian Way.  Take bus 118 from the city center.  You can either walk or cycle a portion of this historic road, surrounded by ancient ruins and picturesque scenery.  This offers a balance of history and nature, with ample opportunity for relaxation.  Consider bringing your own water and snacks.  * **Lunch (1:00 PM):** Pack a picnic lunch to enjoy amidst the scenery of the Appian Way.  This is a budget-friendly and relaxing way to enjoy your midday break.  * **Afternoon (2:30 PM):**  Discover the Baths of Caracalla.  These impressive ruins offer a glimpse into Roman daily life.  The vastness of the space also allows for a peaceful and reflective experience.  * **Evening (5:00 PM):**  Return to the city center and visit a local market like Campo de' Fiori (if open, check times).  Enjoy the vibrant atmosphere and perhaps purchase some local produce or souvenirs.  * **Dinner (7:00 PM):** Enjoy a final Roman dinner near your accommodation. You can explore some of the smaller restaurants near your chosen location that you may have spotted during the day.   **Important Notes:**  * This itinerary utilizes public transport (buses and metro). Purchase a Roma Pass or a multi-day travel pass for cost-effective travel. * Always check opening times and ticket prices for attractions in advance. * Wear comfortable shoes, as you'll be doing a lot of walking. * Stay hydrated, especially during warmer months. * Learn a few basic Italian phrases – it will enhance your experience.   Remember to adjust this itinerary based on your energy levels and personal preferences.  Enjoy your Roman holiday!"
New York,4,low,"[""history"", ""adventure"", ""nature"", ""nightlife""]","[""night_owl"", ""budget_conscious"", ""off_beaten_path""]","**Day 1: Exploring Lower Manhattan's History & Nightlife**  * **Morning (Free):** Start your day with a walk across the Brooklyn Bridge.  Enjoy breathtaking city views, especially stunning at sunrise.  Take photos and soak in the atmosphere. Afterwards, explore DUMBO, a charming Brooklyn neighborhood with cobblestone streets and art galleries.  Grab a cheap and delicious bagel from a local bakery for breakfast.  * **Afternoon (Budget):** Immerse yourself in history at the Staten Island Ferry.  It's free and offers spectacular views of the Statue of Liberty and the Manhattan skyline. Spend the afternoon exploring the Financial District, walking past Wall Street and visiting Battery Park.  * **Evening (Budget):**  Enjoy a budget-friendly dinner – try a halal cart for delicious and inexpensive food. Afterwards, experience the vibrant nightlife of the Lower East Side. This area is known for its diverse bars and live music venues, offering a unique and off-the-beaten-path experience.  Many bars have happy hour specials.   **Day 2:  Green Spaces, Hidden Gems & Urban Exploration**  * **Morning (Budget):** Escape the city bustle with a visit to the High Line, an elevated park built on former railway lines. It offers unique city perspectives and is perfect for a leisurely stroll.  * **Afternoon (Budget):** Explore the less-touristy parts of Greenwich Village, wandering through its charming streets and discovering hidden cafes and independent shops.  Pack a picnic lunch to save money.  * **Evening (Budget):**  Head to Governors Island, accessible by ferry (check for affordable ticket options). Explore the car-free island, enjoy the open spaces, and take in panoramic city views as the sun sets. Find a spot with a great view and enjoy your picnic dinner while watching the city lights twinkle.  Later, return to Manhattan and experience the eclectic nightlife of the East Village.   **Day 3:  Adventure & Unexpected Discoveries**  * **Morning (Budget):** Take the subway to the Bronx and explore the New York Botanical Garden (check for free admission days or discounted rates). Enjoy the tranquility of nature amidst the urban landscape.  * **Afternoon (Budget):** Discover the less-visited parts of the Bronx.  Explore some of the smaller parks or neighborhoods, taking the subway to different areas. This is a great opportunity to experience a different side of New York City.  Grab a cheap and filling lunch from a local deli.  * **Evening (Budget):**  Experience a unique nightlife adventure. Consider attending a free concert or event (check local listings online). Alternatively, explore a different neighborhood's bar scene – perhaps the West Village or Harlem for a different vibe.  Street food will keep the evening budget friendly.   **Day 4:  Iconic Landmarks & Farewell**  * **Morning (Budget):** Visit Central Park. Take a walk, rent a rowboat on The Lake, or simply relax and enjoy the greenery.  This is a great place for people-watching and soaking up the atmosphere.  * **Afternoon (Budget):**  See the iconic Grand Central Terminal.  Marvel at its architecture and explore its hidden corners.  Then walk down 5th Avenue, window shopping and enjoying the energy of midtown Manhattan.  * **Evening (Budget):** Enjoy a final budget-friendly dinner, perhaps trying a food truck or a cheap-eats restaurant.  Depending on your flight schedule, you can spend your last few hours revisiting a favorite spot or finding a new hidden gem before heading to the airport.  Consider taking the subway for a final glimpse of the city at night.   **Important Notes:**  * This itinerary relies heavily on public transport (subway). Purchase a 7-day unlimited MetroCard for cost-effectiveness. * Check websites for free admission days or discounted rates at attractions. * Pack comfortable shoes – you'll be doing a lot of walking! * Utilize free Wi-Fi hotspots to save on data roaming charges. * Be aware of your surroundings and take necessary safety precautions, especially at night.   This itinerary balances your interests in history, adventure, nature, and nightlife while remaining budget-conscious and prioritizing off-the-beaten-path experiences, all while catering to your night owl preference. Remember to adapt it based on your specific flight times and energy levels. Enjoy your trip!"
New York,3,low,"[""family"", ""history""]","[""local_experience"", ""night_owl"", ""vegetarian""]","**Day 1: Exploring Lower Manhattan & a Taste of History**  * **Morning (Free):** Start your day with a stroll through Battery Park, enjoying stunning views of the Statue of Liberty and the harbor.  It's free to enter the park and simply enjoy the scenery. Afterwards, walk along the waterfront towards the Financial District. * **Mid-day (Affordable):** Take the free Staten Island Ferry for a breathtaking view of the Statue of Liberty and the Manhattan skyline.  This is a classic New York experience and saves you the cost of a Liberty Island ticket. * **Afternoon (Affordable):** Explore the historic streets of the Financial District. Visit Wall Street, the New York Stock Exchange (view from outside), and Federal Hall, where George Washington was inaugurated. Many of these sites are free to view from the outside or offer free access to certain areas. Grab a cheap and cheerful vegetarian lunch from a food truck or deli in the area. * **Evening (Affordable):** Head to Chinatown for a delicious and budget-friendly vegetarian dinner. Explore the vibrant streets and enjoy the unique atmosphere. Afterwards, experience the nightlife in Chinatown – many smaller bars offer a more local feel than the tourist hotspots.   **Day 2:  Uptown Adventures & Museum Hopping**  * **Morning (Affordable):** Take the subway uptown to Central Park. Spend the morning walking through the park, enjoying the scenery, and perhaps renting a rowboat on The Lake (rental fees apply, but it's a relatively affordable activity).  Alternatively, enjoy the many free green spaces and walking paths. * **Mid-day (Affordable):** Visit the American Museum of Natural History. While admission isn't free, they often have free admission days or discounted rates for families.  Focus on the exhibits that most interest your family – there's plenty to see! Pack your own snacks and drinks to save money. * **Afternoon (Affordable):** Explore the Upper West Side, known for its beautiful brownstones and charming streets.  Window shop along Broadway and soak in the atmosphere.  Find a nearby park for a relaxing break. * **Evening (Affordable):** Enjoy a delicious and affordable vegetarian dinner at a restaurant in the Upper West Side or grab some street food. Many ethnic enclaves offer diverse and cheap options.  Consider a late-night stroll through Central Park to experience a different side of the city.   **Day 3: Brooklyn Bridge & Diverse Borough Exploration**  * **Morning (Affordable):** Walk across the iconic Brooklyn Bridge. Start on the Brooklyn side for the best views of the Manhattan skyline. This is completely free and offers incredible photo opportunities. * **Mid-day (Affordable):** Explore DUMBO, a trendy Brooklyn neighborhood under the Manhattan Bridge.  Enjoy the cobblestone streets, art galleries, and stunning views. Grab a vegetarian lunch from a food stall or cafe in DUMBO – there are plenty of options to suit your tastes. * **Afternoon (Affordable):** Take the subway to a different part of Brooklyn that interests you – perhaps Williamsburg for its hipster vibe or Park Slope for its brownstone beauty.  Explore the local shops and parks, experiencing the diverse character of this borough. * **Evening (Affordable):** Enjoy a final New York dinner. Consider finding a local pizza place for a classic, affordable, and often vegetarian-friendly option. Spend your last few hours enjoying the night owl vibe of your chosen Brooklyn neighborhood.  Perhaps find a local bar with live music for a final taste of authentic New York.   **Important Notes:**  * Purchase a 7-day unlimited MetroCard for easy and affordable transportation around the city. * Pack comfortable shoes – you'll be doing a lot of walking! * Check websites for free admission days or discounted rates at museums and attractions. * Look for happy hour deals at bars and restaurants to save money on drinks. * Always be aware of your surroundings and take necessary safety precautions.   This itinerary focuses on free and affordable activities, utilizing public transportation and highlighting vegetarian dining options, tailored to your family's interest in history and your preference for late-night experiences. Remember to adjust the itinerary based on your family's pace and interests. Have a fantastic trip!"
