destination,duration,budget,core_prefs,special_prefs,itinerary
Tokyo,4,medium,"[""history"", ""shopping"", ""nightlife"", ""nature""]","[""accessibility"", ""vegetarian"", ""night_owl""]","**Day 1: Imperial Grandeur and Shibuya Buzz**  * **Morning (9:00 AM):** Begin your Tokyo adventure at the Imperial Palace East Garden.  Enjoy a peaceful stroll through this historically significant area, accessible via various well-marked entrances.  The grounds are spacious and offer plenty of benches for rest. * **Late Morning (11:00 AM):**  Head to Ginza, known for its upscale shopping and elegant atmosphere. Explore the department stores, window shop, and perhaps grab a vegetarian-friendly lunch at a cafe with accessible seating.  Many restaurants in Ginza offer English menus. * **Afternoon (1:00 PM):** Immerse yourself in the vibrant energy of Shibuya. Witness the iconic scramble crossing, explore the trendy shops around Shibuya 109, and enjoy the people-watching.  Numerous accessible cafes and restaurants cater to various dietary needs. * **Evening (6:00 PM):**  Enjoy a delicious vegetarian dinner in Shibuya. Many restaurants offer options beyond ramen and sushi.  Afterwards, experience Shibuya's nightlife – explore the unique bars and clubs, many of which are accessible.  Consider a quieter bar for a more relaxed atmosphere.  **Day 2: Asakusa Culture and Ueno Serenity**  * **Morning (9:00 AM):** Travel to Asakusa, a historic district. Visit Senso-ji Temple, Tokyo's oldest temple, and explore Nakamise-dori, a charming street filled with traditional shops. Many shops offer accessible entrances. * **Late Morning (11:00 AM):** Take a Sumida River cruise (check accessibility beforehand). This offers a unique perspective of the city and is a relaxing way to travel between locations.  Enjoy the views and the peaceful atmosphere. * **Afternoon (1:00 PM):**  Have lunch at a vegetarian-friendly restaurant in Asakusa.  Many options exist catering to various tastes and budgets. * **Afternoon (2:30 PM):**  Journey to Ueno Park. Visit Ueno Zoo (check accessibility details online) or explore the numerous museums within the park, choosing one that aligns with your interests. Ueno Park is spacious and accessible. * **Evening (6:00 PM):**  Enjoy dinner near Ueno Station, choosing from a variety of restaurants catering to vegetarian preferences.  Afterwards, enjoy the more relaxed nightlife scene in Ueno, potentially finding a quiet Izakaya (Japanese pub) for a late-night drink.   **Day 3:  Day Trip to Hakone (Nature Escape)**  * **Morning (8:00 AM):** Take a scenic train journey to Hakone, a mountain resort town known for its natural beauty and views of Mount Fuji.  Check train accessibility beforehand.  Consider a Hakone Free Pass for cost-effectiveness. * **Daytime (9:00 AM - 5:00 PM):** Explore Hakone's highlights: cruise across Lake Ashi, ride the Hakone Ropeway (check accessibility), and visit the Hakone Open-Air Museum (check accessibility). Enjoy the stunning views and serene atmosphere.  Pack snacks or find vegetarian-friendly options in Hakone. * **Evening (6:00 PM):** Return to Tokyo and have dinner near your accommodation. There are many options for vegetarian food near major stations.  **Day 4: Harajuku Trend & Shinjuku Heights**  * **Morning (10:00 AM):** Explore Harajuku, known for its unique street style and quirky shops. Wander down Takeshita Street, browse the vintage clothing stores, and soak up the vibrant atmosphere.  Many shops are accessible. * **Afternoon (1:00 PM):** Enjoy a vegetarian lunch in Harajuku.  This area offers a diverse range of dining options. * **Afternoon (2:30 PM):** Head to Shinjuku Gyoen National Garden for a tranquil escape from the city buzz. Explore the various garden styles and enjoy the serene atmosphere.  The garden is largely accessible. * **Evening (5:00 PM):** Ascend the Tokyo Metropolitan Government Building for panoramic city views (free!).  Enjoy sunset over the city. * **Night (7:00 PM):**  Experience Shinjuku's vibrant nightlife.  Choose from a range of bars and restaurants catering to diverse preferences.  Consider a rooftop bar for stunning night views.   Remember to purchase a Suica or Pasmo card for easy and efficient travel on public transportation.  Always check accessibility information for specific locations beforehand to ensure a smooth and enjoyable trip.  Enjoy your Tokyo adventure!"
Bangkok,7,low,"[""history"", ""nature"", ""relaxation"", ""nightlife""]","[""early_riser"", ""sustainable"", ""instagram_worthy""]","**Day 1: Arrival & Old City Charm**  * **Morning (6:00 AM):** Arrive at Suvarnabhumi Airport (BKK). Take the Airport Rail Link to Phaya Thai station, then connect to the BTS Skytrain to your pre-booked budget-friendly accommodation near the Chao Phraya River.  Settle in and grab a quick, delicious, and Instagrammable breakfast from a local street vendor. * **Late Morning (8:00 AM):** Explore Wat Arun (Temple of Dawn) at sunrise – the golden light makes for stunning photos.  Take the ferry across the river for a scenic and affordable journey. * **Afternoon (12:00 PM):**  Enjoy a cheap and cheerful Pad Thai lunch from a street food stall near Wat Arun. * **Afternoon (1:30 PM):** Visit the Grand Palace and Wat Phra Kaew (Temple of the Emerald Buddha).  Remember to dress respectfully (shoulders and knees covered). This is a must-see historical site, but be prepared for crowds. * **Late Afternoon (4:00 PM):** Take a longtail boat ride along the Chao Phraya River for a unique perspective of the city's temples and riverside life. Negotiate the price beforehand. * **Evening (6:00 PM):**  Find a local restaurant for a budget-friendly dinner. Explore the vibrant Yaowarat (Chinatown) area afterwards for a taste of the bustling nightlife and street food.  **Day 2:  Markets & River Cruise**  * **Morning (7:00 AM):** Start your day at the Damnoen Saduak Floating Market (consider a pre-booked tour for better value or take a public bus for a more adventurous, budget-friendly option).  This early start avoids the largest crowds and gives you the best light for photos. * **Afternoon (1:00 PM):** Enjoy lunch at the floating market – try some fresh fruit and local delicacies. * **Afternoon (2:30 PM):**  Return to Bangkok and relax by the river. * **Evening (6:00 PM):** Take a sunset dinner cruise along the Chao Phraya River. Several affordable options are available, offering stunning views and a relaxing experience.   **Day 3:  Nature Escape & Rooftop Views**  * **Morning (7:00 AM):** Visit Bang Krachao, the ""Green Lung"" of Bangkok. Rent a bicycle and explore the peaceful canals and lush greenery. This is a perfect spot for Instagram-worthy nature shots. * **Afternoon (12:00 PM):** Have a picnic lunch amidst the natural beauty of Bang Krachao, bringing your own food to save money. * **Late Afternoon (3:00 PM):** Head back to the city and find a rooftop bar with affordable drinks for sunset views. Many offer happy hour deals. * **Evening (7:00 PM):** Explore the nightlife in a neighborhood like Khao San Road (budget-friendly options available) or Sukhumvit (more diverse options, but potentially more expensive).  **Day 4:  Culture & Local Life**  * **Morning (8:00 AM):** Visit Wat Saket (Golden Mount) for panoramic city views. Climb the stairs for a rewarding experience and stunning photos. * **Late Morning (10:00 AM):** Explore the Jim Thompson House, a museum showcasing the life and collection of an American silk entrepreneur. (Note: This has an entrance fee). * **Afternoon (12:00 PM):**  Enjoy a delicious and affordable lunch at a local eatery. * **Afternoon (1:30 PM):** Wander through the vibrant streets of Pak Khlong Talat flower market. The colors and aromas are incredibly photogenic. * **Evening (6:00 PM):** Indulge in a traditional Thai massage – many affordable options are available throughout the city.  **Day 5:  Day Trip to Ayutthaya**  * **Morning (6:00 AM):** Take an early train to Ayutthaya, the former capital of Thailand. This is a cheaper and more sustainable option than a tour. * **Morning/Afternoon:** Explore the ancient temples and ruins of Ayutthaya. Rent a bicycle to navigate the historical park efficiently. Pack your own snacks and water to save money. * **Evening (6:00 PM):** Return to Bangkok by train.  **Day 6:  Shopping & Relaxation**  * **Morning (9:00 AM):** Explore Chatuchak Weekend Market (open Saturdays and Sundays only). This massive market offers a huge variety of goods, from clothing and souvenirs to food and antiques"
Bali,3,high,"[""culture"", ""relaxation"", ""nature"", ""nightlife""]","[""early_riser"", ""local_experience"", ""luxury""]","**Day 1: Ubud's Cultural Heart & Luxurious Relaxation**  * **6:00 AM:** Begin your day with a private sunrise yoga session overlooking the Tegalalang Rice Terraces. Your instructor will meet you at your luxurious villa (consider Mandapa, a Ritz-Carlton Reserve, or Four Seasons Resort Bali at Sayan).  Enjoy a healthy, locally-sourced breakfast afterwards. * **8:00 AM:** Explore the Tegalalang Rice Terraces with a private guide, learning about traditional Balinese irrigation systems and rice cultivation. Take breathtaking photos and immerse yourself in the lush greenery. * **10:00 AM:** Visit a local artisan village, such as Ubud's renowned wood carving or silver crafting centers.  Engage with artisans directly, witnessing their skills and perhaps purchasing unique handcrafted souvenirs. * **12:00 PM:** Indulge in a fine dining experience at Locavore, known for its innovative tasting menus featuring fresh, locally-sourced ingredients. * **2:00 PM:**  Check into your luxurious Ubud accommodation and enjoy the resort facilities.  Consider a rejuvenating Balinese massage at the spa. * **5:00 PM:**  Attend a traditional Balinese dance performance at Ubud Palace.  The graceful movements and intricate costumes will offer a captivating cultural experience. * **7:00 PM:** Enjoy a sophisticated cocktail at a rooftop bar overlooking the Ubud jungle before a delicious dinner at Bridges Bali, known for its stunning views and exceptional cuisine.   **Day 2: Spiritual Journey & Beachside Bliss**  * **6:00 AM:** Start your day with a private meditation session at Tirta Empul Temple, a sacred water temple.  Your guide will explain the spiritual significance of the temple and its cleansing rituals. * **8:00 AM:** Enjoy a leisurely breakfast at your hotel. * **9:00 AM:**  Drive to Uluwatu Temple, perched dramatically on a cliff overlooking the Indian Ocean. Witness a Kecak dance performance at sunset (schedule accordingly). * **12:00 PM:**  Transfer to a luxurious beachfront resort in Nusa Dua or Seminyak (consider The Mulia Resort & Villas Nusa Dua or W Bali - Seminyak). Enjoy lunch at your hotel or a nearby upscale restaurant. * **2:00 PM:** Relax by the pool, enjoy the beach, or indulge in water sports. * **6:00 PM:**  Experience a private sunset cocktail cruise along the coast. * **8:00 PM:**  Enjoy a fine dining experience at a beachfront restaurant, savoring the fresh seafood and the ocean breeze. Afterward, explore the vibrant nightlife scene in Seminyak, known for its stylish bars and clubs.   **Day 3: Volcanic Views & Farewell Feast**  * **6:00 AM:**  Embark on a private tour to Mount Batur, witnessing a breathtaking sunrise from the summit (arrange a local guide and porter for the hike). * **9:00 AM:**  Enjoy a traditional Balinese breakfast with a view after your descent. * **10:00 AM:**  Visit a coffee plantation and learn about the process of producing Luwak coffee, a unique and expensive coffee variety. Sample various coffee and tea blends. * **12:00 PM:**  Relax and enjoy lunch at a restaurant overlooking the scenic landscapes. * **2:00 PM:**  Return to your hotel, relax by the pool, or indulge in a final spa treatment. * **5:00 PM:** Enjoy a farewell dinner at Merah Putih, a fine-dining establishment showcasing modern Indonesian cuisine in a luxurious setting. * **7:00 PM:** Transfer to the airport for your departure, reminiscing about your unforgettable Balinese journey.   **Note:** This itinerary is a suggestion and can be adjusted to your preferences.  Pre-booking private transportation, tours, and fine dining reservations is highly recommended, especially during peak season.  Enjoy your luxurious Balinese escape!"
Istanbul,4,low,"[""shopping"", ""culture""]","[""needs_breaks"", ""local_experience""]","**Day 1: Immersive Sultanahmet & a Taste of Local Life**  * **Morning (Free):** Start your Istanbul adventure at the Hippodrome, a historical center of the city.  Marvel at the Egyptian Obelisk and the Serpent Column.  Wander through the surrounding area, soaking in the atmosphere.  This is a great place for people-watching and taking in the energy of the city. * **Midday (Budget):** Grab a delicious and affordable *pide* (Turkish flatbread) or *dürüm* (wrap) from a local bakery or street vendor near the Hippodrome. This offers a genuine taste of Istanbul's culinary scene. * **Afternoon (Budget):** Explore the magnificent Hagia Sophia.  Pre-book your tickets online to save time and potentially money. Afterwards, visit the nearby Blue Mosque (Sultanahmet Camii), remembering to dress respectfully (shoulders and knees covered).  Take a break to sit in Gülhane Park, a beautiful green space offering respite from the bustling city. * **Evening (Budget):**  Enjoy a budget-friendly dinner at a local *lokantası* (small restaurant) in Sultanahmet.  Many offer daily specials at very reasonable prices. Afterwards, take a leisurely stroll through the illuminated streets of Sultanahmet, enjoying the magical ambiance.  **Day 2: Topkapi Palace, Grand Bazaar Bargains & Spice Market Sensations**  * **Morning (Budget):** Visit Topkapi Palace, the opulent former residence of Ottoman Sultans. Allocate ample time to explore its courtyards, museums, and breathtaking views. Remember to purchase your tickets in advance online. * **Midday (Budget):**  Dive into the vibrant chaos of the Grand Bazaar.  This is a shopper's paradise!  Practice your bargaining skills and look for unique souvenirs and textiles.  Take a break to enjoy some Turkish Delight from one of the many shops. * **Afternoon (Budget):**  Immerse yourself in the aromatic world of the Spice Market (Egyptian Bazaar).  Sample different spices, teas, and Turkish coffee. This is a great place to buy affordable and flavorful souvenirs. * **Evening (Budget):**  Find a small, local restaurant near your chosen accommodation for dinner. This allows for a break and a chance to try another delicious and affordable meal. Consider trying *mantı* (Turkish dumplings).  **Day 3:  Across the Golden Horn & Balat's Charm**  * **Morning (Budget):** Take a scenic tram ride across the Golden Horn, separating the European and historical sides of Istanbul.  Enjoy the views of the city skyline. * **Midday (Budget):** Explore the charming neighborhood of Balat, known for its colorful houses, antique shops, and vibrant street art.  This area offers a unique and less touristy experience.  Enjoy lunch at a casual eatery in Balat – many offer delicious and affordable options. * **Afternoon (Budget):** Continue exploring Balat and Fener, admiring the beautiful architecture and the peaceful atmosphere.  Consider visiting the Ecumenical Patriarchate of Constantinople. * **Evening (Budget):**  Head back towards Sultanahmet and enjoy a simple, affordable dinner from a street vendor or a small local restaurant.  Reflect on your Istanbul adventure so far.  **Day 4:  Farewell Istanbul - Süleymaniye Mosque & Last-Minute Shopping**  * **Morning (Free/Budget):** Visit the impressive Süleymaniye Mosque, another architectural masterpiece.  Remember to dress respectfully.  Afterwards, take some time to relax and reflect on your trip. * **Midday (Budget):**  Depending on your flight time, you might have time for some last-minute souvenir shopping at the Grand Bazaar or Spice Market for any items you missed.  Alternatively, enjoy a final Turkish coffee and pastry at a local café. * **Afternoon (Budget):**  Head to the airport, allowing ample time for transportation and check-in.  Remember to utilize public transportation for cost-effectiveness.   This itinerary prioritizes affordable experiences and immerses you in the cultural heart of Istanbul, allowing for breaks and a truly local feel. Remember to factor in travel time between locations when planning your day. Enjoy your trip!"
New York,7,medium,"[""nightlife"", ""culture"", ""relaxation"", ""family""]","[""needs_breaks"", ""instagram_worthy""]","**Day 1: Arrival & Midtown Marvels**  * Arrive at your hotel in Midtown Manhattan (consider a hotel near Bryant Park for easy access to attractions and a lovely green space). Check in and leave your luggage. * **Lunch:** Grab a classic New York slice at Joe's Pizza – a quick, tasty, and budget-friendly option. * **Afternoon:** Explore Times Square (Instagram opportunity!), then head to the Top of the Rock Observation Deck for breathtaking panoramic views of the city – a must-have photo for your feed. * **Evening:**  Enjoy a Broadway show!  Book tickets in advance for a classic or a newer hit. Afterwards, have dinner at a casual restaurant near the theatre district.  Consider Carmine's for a family-style Italian feast. * **Night:** Take a relaxing evening stroll through Bryant Park, enjoying the city lights.   **Day 2: Downtown Delights & Artistic Adventures**  * **Morning:** Start your day with a ferry to Staten Island for stunning views of the Statue of Liberty and the Manhattan skyline (free!).  This is a great Instagram shot. * **Lunch:** Explore the Financial District and grab a casual lunch at a cafe near Wall Street. * **Afternoon:** Visit the 9/11 Memorial & Museum (allow ample time for reflection). This is a powerful and moving experience. * **Evening:** Explore the vibrant art scene in the West Village. Wander through galleries and enjoy the charming atmosphere.  Dinner at a West Village restaurant offers a range of options to suit your taste. * **Night:** Enjoy a quieter evening, perhaps with drinks at a cozy bar in the West Village.   **Day 3: Central Park Escape & Museum Hop**  * **Morning:** Spend the morning in Central Park. Rent a rowboat on The Lake, have a picnic lunch (pack your own or grab something from a nearby deli), and enjoy the beautiful scenery.  This offers plenty of Instagram opportunities. * **Afternoon:** Choose a museum based on your family's interests: The Metropolitan Museum of Art (large, diverse collection), the American Museum of Natural History (dinosaurs!), or the Museum of Modern Art (MoMA). * **Evening:**  Enjoy dinner in the Upper West Side near the museum you chose.  Many restaurants cater to families. * **Night:**  Relax at your hotel or enjoy a quieter evening – a perfect time to recharge after a busy few days.   **Day 4: Brooklyn Bridge & DUMBO Charm**  * **Morning:** Walk or cycle across the Brooklyn Bridge – iconic views and another prime Instagram moment. Start on the Brooklyn side for the best Manhattan skyline views. * **Lunch:** Explore DUMBO (Down Under the Manhattan Bridge Overpass) and enjoy lunch with a view of the Manhattan Bridge and the city skyline. Many cafes offer outdoor seating. * **Afternoon:** Explore DUMBO's trendy shops and art galleries. Take photos of the cobblestone streets and the Manhattan Bridge. * **Evening:** Head to a rooftop bar in Brooklyn for stunning city views and cocktails (consider 1 Hotel Brooklyn Bridge for a splurge-worthy option, or find a more affordable alternative). * **Night:** Enjoy dinner in DUMBO before heading back to Manhattan.   **Day 5: Greenwich Village & Chelsea Market**  * **Morning:** Explore Greenwich Village, known for its bohemian atmosphere, independent shops, and charming streets. * **Lunch:** Visit Chelsea Market, a vibrant food hall with diverse culinary options – a great place for everyone to find something they like. * **Afternoon:** Visit the High Line, an elevated park built on former railway lines, offering unique city views and Instagram-worthy photo opportunities. * **Evening:** Enjoy a family-friendly dinner in Chelsea, followed by a relaxed evening. * **Night:**  Enjoy a stroll along the Hudson River.   **Day 6:  Exploring a Borough & Nightlife**  * **Morning:** Choose a borough to explore – the Bronx (for the Bronx Zoo or Yankee Stadium), Queens (for diverse neighborhoods and street art), or even a return trip to Brooklyn to explore a different neighborhood. * **Lunch:** Grab lunch in the chosen borough – explore local options. * **Afternoon:** Continue exploring the chosen borough. * **Evening:** Get ready for a taste of NYC nightlife!  Consider a speakeasy for a unique experience, or a lively bar in a neighborhood you enjoyed earlier in the week. * **Night:** Enjoy dinner and drinks in the chosen nightlife area.   **Day 7: Departure**  * **Morning:** Enjoy a leisurely breakfast. Depending on your flight time, you might have time for some last-minute souvenir shopping or a revisit to a favorite spot. * Depart from your hotel and head to the airport.   This itinerary"
Barcelona,5,high,"[""shopping"", ""nature""]","[""local_experience"", ""group_activities"", ""vegetarian""]","**Day 1: Arrival and Gothic Charm**  * **Morning (10:00 AM):** Arrive at Barcelona El Prat Airport (BCN).  A private car transfer will take you to your luxurious hotel in the Gothic Quarter, such as Hotel Arts Barcelona or Mandarin Oriental, Barcelona. Settle in and leave your luggage. * **Afternoon (12:00 PM):** Enjoy a leisurely vegetarian lunch at a Michelin-recommended restaurant in the Gothic Quarter, like Dos Palillos (modern Asian cuisine with vegetarian options). * **Afternoon (2:00 PM):** Embark on a private guided walking tour of the Gothic Quarter, exploring hidden alleyways, ancient Roman ruins, and the Barcelona Cathedral. Your guide will share fascinating historical anecdotes and local insights. * **Late Afternoon (4:00 PM):** Indulge in some high-end shopping at boutiques along Passeig de Gràcia, known for its architectural masterpieces and designer stores. * **Evening (7:00 PM):** Enjoy a pre-dinner cocktail at a rooftop bar overlooking the city, followed by a gourmet vegetarian dinner at a restaurant with a focus on seasonal Catalan ingredients.   **Day 2: Gaudí's Masterpieces and Park Güell Magic**  * **Morning (9:00 AM):** Begin your day with a private guided tour of Sagrada Família, bypassing the long queues.  Your expert guide will provide detailed explanations of Gaudí's architectural genius. * **Late Morning (11:00 AM):**  Visit Park Güell, another of Gaudí's whimsical creations.  A private driver will transport you, ensuring a comfortable and efficient journey. Explore the park at your own pace, enjoying the stunning mosaic benches and panoramic city views. * **Afternoon (1:00 PM):** Enjoy a delicious vegetarian picnic lunch amidst the beauty of Park Güell, pre-arranged by your hotel concierge. * **Afternoon (3:00 PM):** Immerse yourself in the world of Gaudí with a visit to Casa Batlló and Casa Milà (La Pedrera), marveling at their unique facades and interiors. Pre-booked tickets will guarantee a seamless experience. * **Evening (6:00 PM):** Participate in a private paella-making class focusing on vegetarian options. Learn the art of preparing this iconic Spanish dish from a local chef in a charming setting.  Enjoy the fruits of your labor for dinner.   **Day 3: Coastal Beauty and Culinary Delights**  * **Morning (9:00 AM):** Take a private boat trip along the Barcelona coastline.  Enjoy breathtaking views of the city skyline, Barceloneta Beach, and the Mediterranean Sea.  Perhaps even spot some dolphins! * **Afternoon (12:00 PM):**  Have a luxurious vegetarian lunch at a seaside restaurant in Barceloneta, savoring fresh seafood (vegetarian options available) and the ambiance of the beach. * **Afternoon (2:00 PM):** Explore the vibrant Barceloneta neighborhood, strolling along the beach, browsing the shops, and soaking up the Mediterranean atmosphere. * **Late Afternoon (4:00 PM):** Indulge in some retail therapy at El Corte Inglés, a high-end department store offering a wide selection of luxury brands. * **Evening (7:00 PM):** Experience a unique dining experience at a Michelin-starred restaurant known for its innovative vegetarian tasting menu.   **Day 4: Montserrat Mountain and Artistic Exploration**  * **Morning (9:00 AM):**  Enjoy a private chauffeured excursion to Montserrat Monastery, a breathtaking mountaintop Benedictine monastery.  The journey offers spectacular views. * **Late Morning (11:00 AM):** Explore the monastery, marvel at the Black Madonna statue, and enjoy the stunning mountain scenery.  Consider a guided tour to learn more about the monastery's history and significance. * **Afternoon (1:00 PM):** Have a delightful vegetarian lunch at a restaurant near Montserrat, enjoying local Catalan cuisine with mountain views. * **Afternoon (3:00 PM):** Return to Barcelona and visit the Picasso Museum, immersing yourself in the early works of the renowned artist.  Pre-booked tickets are recommended. * **Evening (6:00 PM):** Enjoy a Flamenco show with dinner at a traditional tablao, experiencing the passion and artistry of this iconic Spanish dance form (ensure vegetarian options are available when booking).   **Day 5: Departure**  * **Morning (9:00 AM):** Enjoy a final leisurely breakfast at your hotel.  Perhaps take a final stroll through your favorite neighborhood. * **Late Morning (11:00 AM):** Depending on your flight schedule, you may have time for some"
